{
  "type": "object",
  "required": true,
  "$schema": "http://json-schema.org/draft-03/schema",
  "properties": {
    "published": {
      "type": "boolean",
      "required": false
    },
    "layout": {
      "type": "string",
      "required": false
    },
    "lang": {
      "type": "string",
      "required": false
    },
    "experience": {
      "type": "string",
      "required": false
    },
    "url": {
      "type": "string",
      "required": false
    },
    "title": {
      "type": "string",
      "required": false
    },
    "content": {
      "type": "string",
      "required": false
    },
    "date": {
      "type": "string",
      "required": false
    },
    "tags": {
      "type": "array",
      "required": false,
      "items": {
        "type": "array"
      }
    },
    "sort": {
      "type": "number",
      "required": false
    },
    "id": {
      "type": "string",
      "required": false
    },
    "categories": {
      "type": "array",
      "required": false,
      "items": {
        "type": "array"
      }
    },
    "excerpt": {
      "type": "string",
      "required": false
    },
    "path": {
      "type": "string",
      "required": false
    }
  }
}